6,1,扩展,,,,娇气,jiāoqì ,"delicate, squeamish, finicky",,,,bié shānghài tā de gǎnqíng—— tā hěn jiāoqì,别伤害她的感情——她很娇气。,Don't hurt her feelings she bruises very easily.,
6,1,扩展,,,,挑拨,tiǎobō ,"to incite disharmony, to instigate",,,,qiānwàn bùyào tiǎobō fūfù guānxi,千万不要挑拨夫妇关系。,Never get between husband and wife.,
6,1,扩展,,,,留恋,liúliàn ,"reluctant to leave, to hate to have to go, to recall fondly",,,,nǐ gāi háobù liúliàn dì cízhí,你该毫不留恋地辞职。,You should do the honorable thing and resign.,
6,1,扩展,,,,恩怨,ēnyuàn ,"gratitude and grudges, resentment, grudges, grievances",,,,wǒ duì tā bù bào gèrén ēnyuàn,我对他不抱个人恩怨。,I have no personal feelings against him.,
6,1,扩展,,,,艘,sōu ,measure word for ship,,,,nà sōu chuán yù dàoliǎo jù làng,那艘船遇到了巨浪。,"The ship was struck by a heavy sea, ie a large wave.",
6,1,扩展,,,,福气,fúqi,"good fortune, to enjoy good fortune",,,,zhēnshi nǚ'ér men de fúqi,真是女儿们的福气！,What a fine thing for our girls!,
6,1,扩展,,,,气质,qìzhì ,"temperament, personality traits, manners",,,,tā yǒu yìshùjiā de qìzhì,他有艺术家的气质。,He has an artistic temperament.,
6,1,扩展,,,,筐,kuāng ,basket,,,,qǐng bǎ tā tóurù dào kuāng zhōng,请把它投入到筐中。,Please put it into the basket.,
6,1,扩展,,,,磅,bàng ,pound,,,,tā bǐ wǒ zhòng10  bàng,他比我重10 磅。,He outweighs me by ten pounds.,
6,1,扩展,,,,挑剔,tiāoti ,"picky, fussy",,,,qióng duì shíwù hěn tiāoti,琼对食物很挑剔。,Jean' s very choosy about food.,
6,1,扩展,,,,风趣,fēngqù ,"charm, humor, wit, humorous, witty",,,,tā shuōhuà xiāngdāng fēngqù,他说话相当风趣。,He is a bit of a wag.,
6,1,扩展,,,,伶俐,línglì ,"clever, witty, intelligent",,,,tā kǒuchǐlínglì,她口齿伶俐。,She has a ready tongue.,
6,1,扩展,,,,闲话,xiánhuà ,"gossip, complaint, scandal",,,,tīngxìn xiánhuà de rén,听信闲话的人,a believer of gossip,
6,1,扩展,,,,丸,wán ,pill,,,,liùshén wán,六神丸,Liushen Pills,
6,2,1,1,,,和蔼,hé'ǎi ,"kindly, nice, amiable",,,,nàge yǒushàn de tuīxiāoyuán miàndài hé'ǎi de xiàoróng,那个友善的推销员面带和蔼的笑容。,The friendly salesman had a bland smile.,
6,2,1,2,,,和气,héqi ,"friendly, polite, amiable",,,,tā héqi chéngshí suǒyǐ rénrén dōu xǐhuan tā,他和气诚实，所以人人都喜欢他。,Everybody likes him as he is kind and honest.,
6,2,1,3,,,目光,mùguāng ,"sight, vision, view, gaze, look",,,Changed,tā shì yī gè mùguāng yuǎndà de rén,他是一个目光远大的人。,He is a man of far sight.,
6,2,1,4,,,慈祥,cíxiáng ,"kindly, benevolent (often of older person)",,,,nǎinai cíxiáng dì xiào le xiào,奶奶慈祥地笑了笑。,Granny smiled an affable smile.,
6,2,1,5,,,跨,kuà ,"to step across, to stride over, to straddle, to span",,,Changed,zhàlán tài ǎi le lián yī gè shí suì de nánhái dōu néng kuà guòqu,栅栏太矮了，连一个十岁的男孩都能跨过去。,The fence is so low even a ten-year-old boy can stride it.,
6,2,1,6,,,自主,zìzhǔ ,"independent, to act for oneself, autonomous",,,,zìzhǔ xìngjiāoyì,自主性交易,independent operation,
6,2,1,7,,,甭,béng ,need not,,,,béng kèqi,甭客气。,Don't stand on ceremony.,
6,2,1,8,,,脱离,tuōlí ,"to separate oneself from, to break away from, diastasis (medicine)",,,,gànbù bùnéng tuōlí qúnzhòng,干部不能脱离群众。,A cadre mustn't be divorced from the masses.,
6,2,1,9,,,诱惑,yòuhuò ,"to entice, to lure, to induce, to attract",,,,bù wéi yòuhuò suǒ dòng,不为诱惑所动,be adamant to temptation,
6,2,1,10,,,无比,wúbǐ ,"incomparable, matchless",,,Changed,tā céngjīng měilì wúbǐ,她曾经美丽无比。,She used to be a beauty beyond compare.,
6,2,1,11,,,向往,xiàngwǎng ,"to yearn for, to look forward to",,,Changed,tā xiàngwǎng zhe làngmàn měilì hé àiqíng,他向往着浪漫，美丽和爱情。,He yearned for romance and beauty and love.,
6,2,1,12,,,孤独,gūdú ,"lonely, solitary",,,,rúguǒ méiyǒu rén zuòbàn wǒ gǎndào gūdú,如果没有人作伴我感到孤独。,I am lonely if I have no company.,
6,2,1,13,,Outside HSK,哭鼻子,kūbízi ,to snivel (usually humorous),,,,,,,
6,2,1,14,,,片刻,piànkè ,"short period of time, a moment",,,Changed,tā chénsī piànkè hòu cái huídá,他沉思片刻后才回答。,"After a minute's reflection, he answered.",
6,2,1,15,,,步伐,bùfá ,"pace, (measured) step, march",,,Changed,wǒ bìxū jiākuài bùfá fǒuzé jiùyào chí dàoliǎo,我必须加快步伐，否则就要迟到了。,"I'll have to mend my pace, or I'll be late.",
6,2,1,16,,,包围,bāowéi ,"to surround, to encircle, to hem in",,,,qiánfú zài nàxiē shān lǐ de tǔfěi dōu yǐjīng bèi bāowéi le,潜伏在那些山里的土匪都已经被包围了。,The bandits that lay up in those hills have all been rounded up.,
6,2,1,17,,,感染,gǎnrǎn ,"infection, to infect, to influence",,,Changed,tā fèi bù shòu dàoliǎo gǎnrǎn ,他肺部受到了感染。,He suffered from a lung infection.,
6,2,1,18,,,恨不得,hènbude ,"wishing one could do sth, to hate to be unable, itching to do sth",,,,wǒ hènbude mǎshàng huídào jiālǐ,我恨不得马上回到家里。,I couldn't get home fast enough.,
6,2,1,19,,,跟前,gēnqián ,"in front of, close to, nearby, the time just before",,,,méiyǒu duōjiǔ Āndéliè yě láidào tā gēnqián,没有多久安德烈也来到她跟前。,A few moments later Andrey joined her.,
6,2,1,20,,,团圆,tuányuán ,to have a reunion,,,Changed,yuánxíng de yuèbǐng xiàngzhēng zhe jiātíng tuányuán,圆形的月饼象征着家庭团圆。,Round moon cakes symbolizes family’s reunion.,
6,2,1,21,,,近来,jìnlái ,"recently, lately",,,,jìnlái duì Yīngyǔ jiàoyuán de xūqiú pō dà,近来对英语教员的需求颇大。,Teachers of English have lately been in great request.,
6,2,1,22,,,酝酿,yùnniàng ,"(of alcohol) to ferment, (of a crisis) to be brewing",,,,jiūfēn zài yùnniàng zhōng,纠纷在酝酿中。,There is trouble brewing.,
6,2,1,23,,,刹那,chànà ,"an instant (Sanskrit: ksana), split second, the twinkling of an eye",,,,chànà jiān kànbujiàn yǎnqián de yīqiè,刹那间，他看不见眼前的一切。,In a flash he couldn't see anything in front of him.,
6,2,1,24,,,反常,fǎncháng ,"unusual, abnormal",,,,tā zuótiān de biǎoxiàn yǒudiǎnr fǎncháng,他昨天的表现有点儿反常。,His behaviour yesterday was a bit strange.,
6,2,1,25,,,埋怨,mányuàn ,"to complain, to grumble (about), to reproach, to blame",,,,wǒ bùzài mányuàn nǐ la,我不再埋怨你啦。,I won't go blaming you.,
6,2,1,26,,,体谅,tǐliàng ,"to empathize, to allow (for something), to show understanding",,,,tā hěn tǐliàng biéren,他很体谅别人。,He is considerate of others.,
6,2,1,27,,,无精打采,wújīngdǎcǎi ,"dispirited and downcast (idiom); listless, in low spirits, washed out",,,,Zhūlìyè de shēngdiào yīn cuòzhé ér wújīngdǎcǎi,朱丽叶的声调因挫折而无精打采。,Juliet's voice held the flatness of defeat.,
6,2,1,28,,,规划,guīhuà ,"to plan (how to do sth), planning, plan, program",,,,měihuà guónèi gōnglù de guīhuà,美化国内公路的规划,a program to beautify the nation's highways,
6,2,1,29,,,熬,áo ,"to boil, to simmer",,,Changed,chúshī tōngguò zhǔ hěn cháng shíjiān bǎ zhīyè áo nóng le,厨师通过煮很长时间把汁液熬浓了。,The cook reduced the sauce by boiling it for a long time.,
6,2,1,30,,,漫长,màncháng ,"very long, endless",,,Changed,tā zài màncháng de yīshēng zhōng yuèlì shèn fēng,他在漫长的一生中阅历甚丰。,He has seen a good deal in his long life.,
6,2,1,31,,,寂静,jìjìng ,quiet,,,Changed,yī gēn shùzhī tūrán zhéduàn dǎpò le jìjìng,一根树枝突然折断打破了寂静。,The snap of a twig broke the silence.,
6,2,1,32,,,稿件,gǎojiàn ,"rough draft, material contributing to a final document",,,,biānjí yǐ wéi wǒ shěnyuè guò zhè piān gǎojiàn,编辑已为我审阅过这篇稿件。,The editor has read it over for me.,
6,2,1,33,,,难得,nándé ,"seldom, rare, hard to come by",,,,zhèzhǒng cǎoyào hěn nándé,这种草药很难得。,This medicinal herb is hard to come by.,
6,2,1,34,,,心疼,xīnténg ,"to love dearly, to feel sorry for sb, to regret, to grudge",,,,xiǎoháizi men tǎo dōngxi chī de qíngjǐng shízài lìngrén xīnténg,小孩子们讨东西吃的情景实在令人心疼。,The sight of the small children asking for food was enough to wring your withers.,
6,2,1,35,,,掩饰,yǎnshì ,"to cover up, to conceal, to mask, to gloss over",,,,tā wúfǎ yǎnshì zìjǐ shīwàng de qíngxù,她无法掩饰自己失望的情绪。,She couldn't hide her disappointment.,
6,2,1,36,,,隐瞒,yǐnmán ,"to conceal, to hide (a taboo subject), to cover up the truth",,,,zhèngrén yǐnmán le zhòngyào shìshí,证人隐瞒了重要事实。,"The witness held back material facts, ie ones that might influence a decision.",
6,2,1,37,,,唠叨,láodao ,"to prattle, to chatter away, to nag, garrulous, nagging",,,,bùyào lǎoshi láodao xíng bùxíng,不要老是唠叨行不行?,Can you stop nagging all the time?,
6,2,1,38,,,吃苦,chīkǔ ,to bear hardships,,,,zhǔnbèi chīkǔ jiānchíxiàqù,准备吃苦，坚持下去。,Be prepared for a rough time. and hang in there,
6,2,1,39,,,欣慰,xīnwèi ,to be gratified,,,Changed,tā duì érzi de chénggōng gǎndào xīnwèi,他对儿子的成功感到欣慰。,He was gratified by his son's success.,
6,2,1,40,,,本事,běnshì ,"source material, original story",,,,wǒ méixiǎngdào nǐ yǒu zhège běnshì,我没想到你有这个本事。,I did not give you credit for such skill.,
6,2,1,41,,,皱纹,zhòuwén ,wrinkle,,,Changed,tā de zhòuwén suízhe niánlíng zēngzhǎng ér jiāshēn,她的皱纹随着年龄增长而加深。,Her wrinkles deepen with age.,
6,2,1,42,,,顿时,dùnshí ,"immediately, suddenly",,,,jìjìng de shāncūn dùnshí fèiténg qilai,寂静的山村，顿时沸腾起来。,The quiet village suddenly became astir.,
6,2,1,43,,,不由得,bùyóude ,"can't help, cannot but",,,,wǒ bùyóude wūwū yàn yàn dì kū qilai,我不由得呜呜咽咽地哭起来。,I broke out crying and sobbing.,
6,2,1,44,,,热泪盈眶,rèlèiyíngkuàng ,"eyes brimming with tears of excitement (idiom), extremely moved",,,,tā rèlèiyíngkuàng,她热泪盈眶。,Her eyes streamed with tears.,
6,2,扩展,,,,扛,káng ,to raise aloft with both hands,,,,jiào wǒ káng zhège bāo shì bùkěnéng de,叫我扛这个包是不可能的。,It's not likely for me to carry the bag.,
6,2,扩展,,,,搅拌,jiǎobàn ,"to stir, to agitate",,,,tā bǎ táng fàngjìn chá lǐ bìng jiǎobàn tā,他把糖放进茶里并搅拌它。,He put sugar in his tea and stirred it.,
6,2,扩展,,,,掰,bāi ,to break off or break open sth with one's hands,,,,tā bǎ qiǎokèlì bāi chéng liǎng bàn,他把巧克力掰成两半。,He broke the bar of chocolate into two .,
6,2,扩展,,,,挎,kuà ,"to carry (esp. slung over the arm, shoulder or side)",,,,shǒubì shàng kuà zhe yī gè lánzi,手臂上挎着一个篮子,have a basket on one's arm+ [ 1 ],
6,2,扩展,,,,搀,chān ,to take by the arm and assist,,,,zhè niúnǎi yǐ chān guò shuǐ le,这牛奶已搀过水了。,This milk has been watered down.,
6,2,扩展,,,,晾,liàng ,"to dry in the air, (fig.) to cold-shoulder",,,,chuángdān dōu liàng zài shéng shàng,床单都晾在绳上。,The sheets were aired on the line.,
6,2,扩展,,,,敬礼,jìnglǐ ,"to salute, salute",,,,shìbīng xiàng jūnguān jìnglǐ,士兵向军官敬礼。,The soldier saluted the officer.,
6,2,扩展,,,,飞翔,fēixiáng ,"to circle in the air, to soar",,,,niǎo shàngxià fēixiáng,鸟上下飞翔。,The birds rose and dipped in their flight.,
6,2,扩展,,,,鞠躬,jūgōng ,to bow,,,,tā jūgōng zhìxiè,她鞠躬致谢。,She bowed her thanks.,
6,2,扩展,,,,啃,kěn ,"to gnaw, to nibble, to bite",,,,tā kěn píngguǒ,他啃苹果。,He nibbled on the apple.,
6,3,1,1,,Outside HSK,月饼,yuèbǐng ,mooncake (esp. for the Mid-Autumn Festival),,,,,,,
6,3,1,2,,,清晨,qīngchén ,early morning,,,,tā chí zhì qīngchén liǎng diǎn cái huíjiā,他迟至清晨两点才回家。,He came home as late as two in the morning.,
6,3,1,3,,,迎面,yíngmiàn ,"directly, head-on (collision), in one's face (of wind)",,,,fēng yíngmiàn chuī lái,风迎面吹来。,The wind was right in our faces.,
6,3,1,4,,,模样,múyàng ,"look, style, appearance, approximation, about, also pr.",,,,fángzi réng shì tā líkāi shí de múyàng,房子仍是她离开时的模样。,It was replica of the bungalow she had left.,
6,3,1,5,,,打量,dǎliang ,"to size sb up, to look sb up and down, to take the measure of",,,,tā bǎ tā húnshēn zǐxì dǎliang le yī fān,他把他浑身仔细打量了一番。,He looked him over critically.,
6,3,1,6,,,番,fān ,measure word similar to 遍,,,,zhèxiē jiùshì tā nà fān huà de jīdiào,这些就是他那番话的基调。,This was the groundwork of his oration.,
6,3,1,7,,,搓,cuō ,"to rub or roll between the hands or fingers, to twist",,,,tā cuō cā shuāngshǒu,他搓擦双手。,He rubbed his hands together.,
6,3,1,8,,,迟疑,chíyí ,to hesitate,,,,tā chíyí yú liǎng zhǒng kànfǎ zhījiān,他迟疑于两种看法之间。,He wavered between the two opinions.,
6,3,1,9,,,拜托,bàituō ,"to request sb to do sth, please!",,,,shuō tā yǒu sīshì yào bàituō nín,说她有私事要拜托您。,She said she wanted to ask you a personal favor.,
6,3,1,10,,,饱经沧桑,bǎojīngcāngsāng ,having lived through many changes,,,,bǎojīngcāngsāng de rén bùyì jǔsàng—— Yuēhànxùn,饱经沧桑的人，不易沮丧。——约翰逊,A man used to vicissitudes is not easily dejected. -- Samuel Johnson,
6,3,1,11,,,流露,liúlù ,"to express, to reveal (one's thoughts or feelings)",,,,tā de shēngyīn zhōng liúlùchū shānggǎn,她的声音中流露出伤感。,Her voice dripped sentimentality.,
6,3,1,12,,,朴实,pǔshí ,"plain, simple, guileless, down-to-earth, sincere and honest",,,,cūguǎng ér pǔshí de tàidu,粗犷而朴实的态度,rugged manners,
6,3,1,13,,,过于,guòyú ,"too much, excessively",,,,guòyú xiángxì de shuōmíng,过于详细的说明,a meticulous account,
6,3,1,14,,,操劳,cāoláo ,"to work hard, to look after",,,,zhè shì qǐng nín duō cāoláo,这事请您多操劳。,Would you mind looking after this?,
6,3,1,15,,,胡须,húxū ,beard,,,,tā tì diào le húxū,他剃掉了胡须。,He shaved off his beard.,
6,3,1,16,,,起码,qǐmǎ ,"at the minimum, at the very least",,,,tā qǐmǎ yī xīngqī chūqù yīcì,他起码一星期出去一次。,He's going away for at least a week.,
6,3,1,17,,,口音,kǒuyin ,oral speech sounds (linguistics),,,Changed,tā shuōhuà yǒudiǎn nánfāng kǒuyin,他说话有点南方口音。,He speaks with a slight southern accent.,
6,3,1,18,,,乡镇,xiāngzhèn ,"village, township",,,,xiāngzhèn qǐyè bǎochí le jiào kuài zēngzhǎng de tàishì,乡镇企业保持了较快增长的态势。,Township enterprises maintained a good momentum of rapid growth.,
6,3,1,19,,,原先,yuánxiān ,"former, original",,,,yuánxiān de sēnlín yǐ bèi gēngdì hé mù chǎngsuǒ qǔdài,原先的森林已被耕地和牧场所取代。,Forests have given place to tillage and pasture.,
6,3,1,20,,,裁缝,cáiféng ,"tailor, dressmaker",,,,tā dào cáiféngdiàn qù shìchuān,他到裁缝店去试穿。,He went to the tailor's for a fitting.,
6,3,1,21,,,港口,gǎngkǒu ,"port, harbor",,,,tāmen jìnzhǐ nàxiē chuánzhī chūrù gǎngkǒu,他们禁止那些船只出入港口。,They embargoed those ships.,
6,3,1,22,,,斯文,sīwén ,"refined, educate, cultured, intellectual, polite, gentle",,,,háizi tīng le kèrén shuō de yōumò huà dōu sīwén dì xiào le,孩子听了客人说的幽默话，都斯文地笑了。,The children smiled politely at the visitor's pleasantries.,
6,3,1,23,,,心眼儿,xīnyǎnr ,"one's thoughts, mind, intention, willingness to accept new ideas",,,,tā kànqǐlái hěn xiōng qíshí xīnyǎnr tǐnghǎo de,他看起来很凶，其实心眼儿挺好的。,"He looks fierce, but in fact he's kindhearted.",
6,3,1,24,,,信誉,xìnyù ,"prestige, distinction, reputation, trust",,,,yínháng dàikuǎn gěi yǒu xìnyù de gùkè,银行贷款给有信誉的顾客。,The bank loaned to good customers.,
6,3,1,25,,,欺骗,qīpiàn ,"to deceive, to cheat",,,,tā qǐtú qīpiàn wǒmen dàn méiyǒu déchěng,他企图欺骗我们，但没有得逞。,He was foiled in his attempt to deceive us/His attempt to deceive us was foiled.,
6,3,1,26,,,学位,xuéwèi ,academic degree,,,,tā yǒu xīnlǐxué de xuéshìxuéwèi,她有心理学的学士学位。,She had an undergraduate degree in psychology.,
6,3,1,27,,,一流,yīliú ,"top quality, front ranking",,,Changed,tā shì gè yīliú zuòjiā,他是个一流作家。,He was a writer of the first rank.,
6,3,1,28,,,主管,zhǔguǎn ,"in charge, responsible for, person in charge, manager",,,,tā zhǔguǎn zhè xiàng yèwù,他主管这项业务。,He superintends this business.,
6,3,1,29,,,助手,zhùshǒu ,"assistant, helper",,,,wǒ zhǎodào jǐge zhùshǒu sànfā chuándān,我找到几个助手散发传单。,I rustle up a few helpers to hand out leaflets.,
6,3,1,30,,,骨干,gǔgàn ,"diaphysis (long segment of a bone), fig. backbone",,,,qǐ gǔgàn zuòyòng,起骨干作用,Play a backbone role,
6,3,1,31,,,小心翼翼,xiǎoxīnyìyì ,"cautious and solemn (idiom); very carefully, prudent",,,,tā duì tā shuōhuà dōu dé xiǎoxīnyìyì,他对她说话都得小心翼翼。,He has to weigh his words when he talks to her.,
6,3,1,32,,,喜悦,xǐyuè ,"happy, joyous",,,,tā de wēixiào lùchū chénggōng de xǐyuè,她的微笑露出成功的喜悦。,Her smile was triumphant.,
6,3,1,33,,,拨,bō ,to push aside,,,,tā bǎ nàozhōng bō dào shàngwǔ shí diǎnzhōng,他把闹钟拨到上午十点钟。,He has set his alarm clock for ten am.,
6,3,1,34,,,仍旧,réngjiù ,"still (remaining), to remain (the same), yet",,,,tā réngjiù shì shí niánqián de lǎoyàngzi,他仍旧是十年前的老样子。,"After ten years, he still looked the same.",
6,3,1,35,,,隐约,yǐnyuē ,"vague, faint, indistinct",,,,yī sōu chuán zài wù zhōng yǐnyuē chūxiàn,一艘船在雾中隐约出现。,A ship loomed out of the fog.,
6,3,1,36,,,浑身,húnshēn ,"all over, from head to foot",,,,tā bǎ tā húnshēn zǐxì dǎliang le yī fān,他把他浑身仔细打量了一番。,He looked him over critically.,
6,3,1,37,,,馅儿,xiànr ,"filling, stuffing",,,Changed,wǒ xǐhuan niúròu xiànr de Mòxīgē juǎnbǐng,我喜欢牛肉馅儿的墨西哥卷饼。,I like a burrito with beef filling.,
6,3,1,38,,,灿烂,cànlàn ,"to glitter, brilliant, splendid",,,,jíguāng de cànlàn,极光的灿烂,the glow of the auroral light,
6,3,1,39,,,惦记,diànjì ,"to think of, to keep thinking about, to be concerned about",,,,nǐ bùyào lǎoshi diànjì zhe zìjǐ guòqu de cuòwù,你不要老是惦记着自己过去的错误。,You should not brood upon your past mistakes,
6,3,1,40,,,丢人,diūrén ,to lose face,,,,pínqióng bù diūrén tōuqiè bùguāng cǎi,贫穷不丢人，偷窃不光采。,"Poverty is not a disgrace, but theft is a disgrace.",
6,3,1,41,,,炫耀,xuànyào ,"to show off, to flaunt",,,,tā xǐhuan xuànyào zìjǐ de zhīshi,他喜欢炫耀自己的知识。,"He likes to air his knowledge, ie let others see how much he knows.",
6,3,1,42,,,面子,miànzi ,"honor, reputation, face (as in ""losing face"")",,,Changed,bùyào pà diūmiànzi,不要怕丢面子。,Don't be afraid of losing face.,
6,3,1,43,,,辜负,gūfù ,"to fail to live up (to expectations), unworthy (of trust), to let down",,,,gūfù le rénmín de xìnrèn,辜负了人民的信任,betray the trust of the people,
6,3,1,44,,,期望,qīwàng ,"to have expectations, to earnestly hope, expectation, hope",,,,wǒ qīwàng tā huì chénggōng,我期望他会成功。,I hope that he will succeed.,
6,3,扩展,,,,嫂子,sǎozi ,sister-in-law,,,,wǒ shūshu de qīzi shì wǒ fùmǔ de sǎozi（ dìxí）,我叔叔的妻子是我父母的嫂子（弟媳）。,"My uncle's wife is my parents' sister-in-law,",
6,3,扩展,,,,泼,pō ,"to splash, to spill, rough and coarse, brutish",,,,shéi bǎ mòshuǐ pō zài wǒ de bǐjìběn shàng,谁把墨水泼在我的笔记本上?,Who spilt ink on my notebook ?,
6,3,扩展,,,,拾,shí ,to ascend in light steps,,,,nàge nóngjiā gūniang shí le xiē cháihuo,那个农家姑娘拾了些柴火。,The country girl gathered some firewood.,
6,3,扩展,,,,伯母,bómǔ ,aunt,,,,wǒ bómǔ zài yījiā túshūguǎn gōngzuò,我伯母在一家图书馆工作。,My aunt works in a library.,
6,3,扩展,,,,岳母,yuèmǔ ,mother-in-law,,,,tā bìxū róngrěn tā de yuèmǔ,他必须容忍他的岳母。,He has to tolerate his wife 's mother .,
6,3,扩展,,,,搂,lǒu ,"to draw towards oneself, to gather, to gather up (one's gown",,,,tā bǎ háizi jǐn lǒu zài huáilǐ,她把孩子紧搂在怀里。,She pressed the child to her bosom.,
6,3,扩展,,,,牵,qiān ,"to lead along, to pull (an animal on a tether)",,,,qiān gǒu dài bèi gǒu bēngjǐn le,牵狗带被狗绷紧了。,The dog was straining at his leash.,
6,3,扩展,,,,侄子,zhízi ,nephew,,,,wǒ de xiǎo zhízi11 suì,我的小侄子11岁。,My younger nephew is 11 years old.,
6,3,扩展,,,,投掷,tóuzhì ,"to throw sth a long distance, to hurl, to throw at",,,,háizimen zài tóuzhì shítou,孩子们在投掷石头。,The children were throwing stones.,
6,3,扩展,,,,削,xiāo ,"to peel with a knife, to pare, to cut (a ball at tennis etc)",,,,qǐng xiāo yī xiāo zhè zhǐ qiānbǐ,请削一削这只铅笔。,Please sharpen this pencil.,
6,3,扩展,,,,掐,qiā ,"to pick (flowers), to pinch, to nip, to pinch off, to clutch",,,,tā qiā nà nánhái de miànjiá,他掐那男孩的面颊。,He pinched the boy's cheek.,
6,3,扩展,,,,绣,xiù ,to embroider,,,,bǎ xìngmíng xiù zài shǒupà shàng,把姓名绣在手帕上,embroider a handkerchief with one's name,
6,3,扩展,,,,拧,nǐng ,"to pinch, wring",,,,tā zài nǐng shī yīfu,他在拧湿衣服。,He is wringing out the wet clothes.,
6,3,扩展,,,,飘扬,piāoyáng ,"to wave, to flutter, to fly",,,,qízi yíngfēng piāoyáng,旗子迎风飘扬。,The flag is waving in the wind.,
6,4,1,1,,,厌倦,yànjuàn ,"to be weary of, to be fed up with, tedious",,,,tā yànjuàn chéng lǐ de gōngzuò kěwàng huíqu guò tiányuán shēnghuó,他厌倦城里的工作，渴望回去过田园生活。,He is tired of his city job and dreams of getting back to the land.,
6,4,1,2,,,厌恶,yànwù ,"to loathe, to hate, disgusted with sth",,,,sùliào huā shì wǒ tèbié yànwù de dōngxi,塑料花是我特别厌恶的东西。,Plastic flowers are a particular hate of mine.,
6,4,1,3,,,倘若,tǎngruò ,"provided that, supposing that, if",,,,tǎngruò nǐ yǒu kùnnan dehuà jiù zhù zài wǒ zhèlǐ ba,倘若你有困难的话，就住在我这里吧。,"If you are in trouble, stay here with me.",
6,4,1,4,,,发觉,fājué ,"to find, to detect, to discover",,,,wǒmen tūrán fājué yǐ láibují gǎnshàng huǒchē le,我们突然发觉已来不及赶上火车了。,We suddenly discovered that it was too late to catch the train.,
6,4,1,5,,,承诺,chéngnuò ,"to promise, to undertake to do something, commitment",,,,wǒ bù xiāngxìn nǐ de chéngnuò,我不相信你的承诺。,I mistrust your promises.,
6,4,1,6,,,草率,cǎoshuài ,"careless, negligent, sloppy, not serious",,,,tā zǒngshì cǎoshuài xíngshì,他总是草率行事。,He behaves in a brash way.,
6,4,1,7,,,对抗,duìkàng ,"to withstand, to resist, to stand off, antagonism, confrontation",,,,fǎnpànfènzǐ wǔzhuāng zìjǐ duìkàng zhèngfǔ,反叛分子武装自己对抗政府。,The rebels armed themselves against the government.,
6,4,1,8,,,尝试,chángshì ,"to try, to attempt",,,,tā de yīqiè chángshì quán guī wúxiào,他的一切尝试全归无效。,All his attempts were in vain.,
6,4,1,9,,,盲目,mángmù ,"blind, blindly, ignorant, lacking understanding",,,,tā mángmù dì fānù,她盲目地发怒。,She is blind with anger.,
6,4,1,10,,,乘,chéng ,"to avail oneself of, to take advantage of",,,,gōngyuán bù yuǎn chéng gōnggòngqìchē yīhuìr jiù dào,公园不远，乘公共汽车一会儿就到。,"The park isn't far away, it's only a short bus ride.",
6,4,1,11,,,喘气,chuǎnqì ,"to breathe deeply, to pant",,,,sàipǎo hòu mǎ chuǎnqì,赛跑后马喘气。,The horse blew short after race.,
6,4,1,12,,,饶恕,ráoshù ,"to forgive, to pardon, to spare",,,Changed,wǒ kěnqiú nǐ ráoshù tā,我恳求你饶恕他。,I adjure you to spare him.,
6,4,1,13,,,强迫,qiǎngpò ,"to compel, to force",,,,tā qiǎngpò wǒ qù,他强迫我去。,He compelled me to go.,
6,4,1,14,,,实施,shíshī ,"to implement, to carry out",,,,xīn fǎlìng xià gè Xīngqīyī kāishǐ shíshī,新法令下个星期一开始实施。,The new law is applicable from next Monday.,
