6,20,1,7,,,工艺品,gōngyìpǐn ,"handicraft article, handiwork",,,,dāngdìjūmín zài lùbiān chénliè tāmen de shǒugōngyì pǐn,当地居民在路边陈列他们的手工艺品。,Local inhabitants display their handicrafts on the wayside.,
6,20,1,8,,,美观,měiguān ,"pleasing to the eye, beautiful, artistic",,,,yìngmù dìbǎn hěn měiguān,硬木地板很美观。,Hardwood floors look beautiful.,
6,20,1,9,,,别致,biézhì ,"unusual, unique",,,,wǒ xǐhuan nǐ yàngshì biézhì de màozi,我喜欢你样式别致的帽子,I like your chic hat.,
6,20,1,10,,,浸泡,jìnpào ,"to steep, to soak, to immerse",,,,bǎ yáng jìnpào yīxià,把羊浸泡一下。,Give the sheep a dip.,
6,20,1,11,,,责怪,zéguài ,"to blame, to rebuke",,,,bié zéguài tā tā zǒng háishi gè háizi,别责怪他，他总还是个孩子。,"Don't blame him. After all, he's only a child.",
6,20,1,12,,,嗨,hāi ,"oh alas, hey!, hi! (loanword)",,,,hāi Jiékè nǐhǎo ma,嗨，杰克，你好吗？,"Hi, Jack. How are you?",
6,20,1,13,,,祖父,zǔfù ,"father's father, paternal grandfather",,,,tā de zǔfù cóngqián shì gè liè xióng de rén,他的祖父从前是个猎熊的人。,His grandfather was a bear-hunter in the old days.,
6,20,1,14,,,废寝忘食,fèiqǐnwàngshí ,to neglect sleep and forget about food (idiom),,,,wǔxiáxiǎoshuō kěyǐ ràng wǒ kàn dé fèiqǐnwàngshí,武侠小说可以让我看得废寝忘食。,Swordsmen novels can make me read day and night with no thought for eating or sleeping.,
6,20,1,15,,,勤俭,qínjiǎn ,hardworking and frugal,,,,qínjiǎn shǐ tā chéngwéi fùwēng,勤俭使他成为富翁。,Diligence and thrift made him a possessor of warm fortunes.,
6,20,1,16,,,富裕,fùyù ,"rich, abundant",,,,tā shēng zài fùyù rénjiā,他生在富裕人家。,He was born to an affluent family.,
6,20,1,17,,,农历,nónglì ,lunar calendar,,,,Zhōngguórén qìngzhù nónglìxīnnián,中国人庆祝农历新年。,Chinese people celebrate the lunar New Year.,
6,20,1,18,,,将近,jiāngjìn ,"almost, nearly, close to",,,,tā jiāngjìn shíqī suì,他将近十七岁。,He is scarcely seventeen years old.,
6,20,1,19,,,况且,kuàngqiě ,"moreover, besides, in addition, furthermore",,,,wǒ bùxiǎng qù kuàngqiě wǒ hěn píjuàn,我不想去，况且我很疲倦。,"I don't want to go; besides, I'm tired.",
6,20,1,20,,,乌黑,wūhēi ,"jet-black, dark",,,,tā tóufa wūhēi qìsè hěn hǎo,她头发乌黑，气色很好。,She has dark hair and a fresh complexion.,
6,20,1,21,,,跟随,gēnsuí ,to follow,,,,tā gēnsuí zài tā mǔqīn zhīhòu jìnrù tīng nèi,她跟随在她母亲之后进入厅内。,She entered the hall after her mother.,
6,20,1,22,,,寻觅,xúnmì ,to look for,,,,nǐ zài xúnmì àiqíng ma,你在寻觅爱情吗?,Are you looking for love?,
6,20,1,23,,,颇,pō ,"quite, rather",,,,tā suī sì fēngkuáng qíshí pō yǒu lǐxìng,他虽似疯狂其实颇有理性。,There's method in his madness.,
6,20,1,24,,,分明,fēnmíng ,"clear, distinct, evidently, clearly",,,,wéi chóu wéi yǒu ēnyuàn fēnmíng,为仇为友，恩怨分明。,It is perfectly clear who are our friends and who are our foes.,
6,20,1,25,,,隐蔽,yǐnbì ,"to conceal, to hide, covert, under cover",,,,chǔyú yǐnbì dìwèi,处于隐蔽地位,stay in the background,
6,20,1,26,,,扎,zhā ,"to prick, to run or stick (a needle etc) into",,,,zhè shì yī kē xīn zāi de shù hái méiyǒu zhā xià gēn lái,这是一颗新栽的树，还没有扎下根来。,It is a newly planted tree and it has not established yet.,
6,20,1,27,,,砖,zhuān ,brick,,,,wàiqiáng shì zhuān qì de,外墙是砖砌的。,The outside walls are brick.,
6,20,1,28,,,拣,jiǎn ,"to choose, to pick, to sort out, to pick up",,,,jiǎn nǐ zuì xǐhuan de ba,拣你最喜欢的吧。,Choose which you like best.,
6,20,1,29,,,撇,piē ,"to cast away, to fling aside",,,,tā piēqù le tāng shàng de dàbùfen fú yóu,她撇去了汤上的大部分浮油。,She skimmed the soup to remove most of the fat.,
6,20,1,30,,,砸,zá ,"to smash, to pound, to fail, to muck up, to bungle",,,,xì yǎn zá le,戏演砸了。,The play is badly performed.,
6,20,1,31,,,膝盖,xīgài ,knee,,,,wǒ diēdǎo shí cāshāng le xīgài,我跌倒时擦伤了膝盖。,I fell and scraped my knee.,
6,20,1,32,,,枝,zhī ,"branch, classifier for sticks, rods, pencils etc",,,,qùpí de liǔshù xì zhī,去皮的柳树细枝,a peeled willow wand,
6,20,1,33,,,拐杖,guǎizhàng ,"crutches, crutch, walking stick",,,,nà lǎohàn zhǔ zhe mù guǎizhàng zǒulù,那老汉拄着木拐杖走路。,The old man walked with a wooden staff.,
6,20,1,34,,,柱,zhù ,pillar,,,,nà liǎng gēn zhù jiān de jùlí wéi sānshí mǐ,那两根柱间的距离为三十米。,The interval between the two posts measures thirty meters.,
6,20,1,35,,,病,bìng ,"illness, disease, to fall ill, defect",,,,xuèyǒubìng huànzhě de xuèyè nínggù bùliáng,血友病患者的血液凝固不良。,A hemophiliac’s blood will not clot properly.,
6,20,1,36,,,挖掘,wājué ,"to excavate, to dig, to unearth",,,,zài tǔ zhōng wājué mǎlíngshǔ,在土中挖掘马铃薯,grub in the earth for potatoes,
6,20,1,37,,,坑,kēng ,"hole, pit, tunnel, to defraud",,,,kēng yuè wā yuè shēn,坑越挖越深。,The pit grew deeper.,
6,20,1,38,,,发炎,fāyán ,"to become inflamed, inflammation",,,,nà shāngkǒu fāyán le,那伤口发炎了。,It's an angry wound.,
6,20,1,39,,,咋,zǎ ,dialectal equivalent of “怎么”,,,,nǐ zǎ bù zhīdào ne,你咋不知道呢？,Why don't you know?,
6,20,1,40,,,侥幸,jiǎoxìng ,"luckily, by a fluke",,,,tā jiǎoxìng táotuō le,他侥幸逃脱了。,By good luck he was able to escape.,
6,20,1,41,,,滋味,zīwèi ,"taste, flavor, feeling",,,,dé mò léi sī tè juéde bùshìzīwèi,德默雷斯特觉得不是滋味。,Demerest thought disgustedly.,
6,20,1,42,,,逢,féng ,"to meet by chance, to come across, to fawn upon",,,,liángjī nán féng,良机难逢,a rare golden opportunity,
6,20,1,43,,,得不偿失,débùchángshī ,the gains do not make up for the losses (idiom),,,,zài shāngyè zhōng yǒushí guòyú jǐnshèn shì débùchángshī de,在商业中有时过于谨慎是得不偿失的。,sometimes it doesn't pay to be overcautious in business.,
6,20,1,44,,,宁肯,nìngkěn ,"would rather..., it would be better..., would prefer",,,,nìngkěn nǐng sǐ bùyào èsǐ,宁肯拧死，不要饿死。,It is better to die of indigestion than of starvation.,
6,20,1,45,,,告诫,gàojiè ,"to warn, to admonish",,,,yīshēng gàojiè wǒmen bùyào xīyān,医生告诫我们不要吸烟。,Doctors tell us not to smoke.,
6,20,1,46,,,欲望,yùwàng ,"desire, longing, appetite, craving",,,,nǐ yīng yǐ lǐxìng lái xiànzhì nǐ de yùwàng,你应以理性来限制你的欲望。,You should bound your desires by reason.,
6,20,1,47,,,贪婪,tānlán ,"avaricious, greedy, rapacious, insatiable, avid",,,,tānlán shì wàn'è zhī gēnyuán,贪婪是万恶之根源。,Greed is the parent of many evils.,
6,20,1,48,,,争夺,zhēngduó ,"to fight over, to contest, to vie over",,,,zài Àolínpǐkè Yùndònghuì shàng xǔduō guójiā zhēngduó jiǎngpái,在奥林匹克运动会上许多国家争夺奖牌。,Many nations contest for medals at the Olympic Games.,
6,20,1,49,,,贪污,tānwū ,"to be corrupt, corruption, to embezzle",,,,zhèwèi bùzhǎng tānwū zhìfù,这位部长贪污致富。,The Minister became rich through graft.,
6,20,1,50,,,贿赂,huìlù ,"to bribe, a bribe",,,,zuìfàn qǐtú huìlù fǎguān,罪犯企图贿赂法官。,The offender attempted to grease the palm of the judge.,
6,20,1,51,,,不择手段,bùzéshǒuduàn ,"by fair means or foul, by hook or by crook, unscrupulously",,,,tā cánrěn、 jiānzhà、 bùzéshǒuduàn,他残忍、奸诈、不择手段。,"He was cruel, treacherous and unscrupulous.",
6,20,扩展,,,,油漆,yóuqī ,"oil paints, lacquer, to paint",,,,nǐ yào tā bǎmén yóuqī chéng lǜsè de ma,你要他把门油漆成绿色的吗？,Do you want him to paint the door into green color?,
6,20,扩展,,,,炊烟,chuīyān ,smoke from kitchen chimneys,,,,chuīyān cóng chúfáng de yāncōng huǎnhuǎn shēngqǐ,炊烟从厨房的烟囱缓缓升起。,Smoke is slowly going up from kitchen chimneys,
6,20,扩展,,,,火焰,huǒyàn ,"blaze, flame",,,,suǒyǒu de fángzi dōu zài huǒyàn zhōng shāohuǐ,所有的房子都在火焰中烧毁。,All the houses perished in flames.,
6,20,扩展,,,,皮革,pígé ,leather,,,,zhè liàozi xiàng pígé bān jiānrèn,这料子像皮革般坚韧。,This material is as tough as leather.,
6,20,扩展,,,,哨,shào ,"a whistle, sentry",,,,cáipàn gāoshēng chuīshào,裁判高声吹哨,The referees blasted their whistles.,
6,20,扩展,,,,证书,zhèngshū ,"credentials, certificate",,,,shānghán miǎnyì zhèngshū,伤寒免疫证书,a typhus immunization certificate,
6,20,扩展,,,,钻石,zuànshí ,diamond,,,,fǎngzào de zuànshí,仿造的钻石,a counterfeit diamond,
6,20,扩展,,,,启事,qǐshì ,announcement,,,,zhēng wén qǐshì,征文启事,"a notice soliciting contributions for a special issue, etc.",
6,21,1,1,,,急剧,jíjù ,"rapid, sudden",,,,gāolú de wēndù jíjù shàngshēng,高炉的温度急剧上升。,The temperature of the blast furnace raced up.,
6,21,1,2,,,川流不息,chuānliúbùxī ,the stream flows without stopping (idiom); unending flow,,,,rénmen chuānliúbùxī dì dàolái,人们川流不息地到来。,People kept coming in streams.,
6,21,1,3,,,登录,dēnglù ,"to register, to log in",,,,yuǎnchéngdēnglù,远程登录,remote login,
6,21,1,4,,,指令,zhǐlìng ,"order, command, instruction",,,,tā yángé zūnshǒu zhǐlìng,他严格遵守指令。,He followed the instructions faithfully.,
6,21,1,5,,,根深蒂固,gēnshēndìgù ,deep-rooted (problem etc),,,,tā de yòuyì guāndiǎn gēnshēndìgù,她的右翼观点根深蒂固。,She is entrenched in her right-wing views.,
6,21,1,6,,,不免,bùmiǎn ,inevitably,,,,tā shēngqì shí bùmiǎn yǒuxiē shīlǐ,他生气时不免有些失礼。,He's rather curt when he's angry.,
6,21,1,7,,,预言,yùyán ,"to predict, prophecy",,,,shǐ yùyán de jiěshì shénmì huà,使预言的解释神秘化,mystify an interpretation of a prophecy,
6,21,1,8,,,革命,gémìng ,"revolution, revolutionary (politics)",,,,gémìng shèngdì,革命圣地,a sacred place of the revolution,
6,21,1,9,,,改良,gǎiliáng ,to improve,,,,zhège chéngshì de zhì'ān jīgòu xūyào gǎiliáng,这个城市的治安机构需要改良。,The city's security apparatus needs reforming.,
6,21,1,10,,,欣欣向荣,xīnxīnxiàngróng ,"luxuriant growth (idiom); flourishing, thriving",,,,wénhuà yìshù shìyè xīnxīnxiàngróng,文化艺术事业欣欣向荣。,Culture and art prospering.,
6,21,1,11,,,仓库,cāngkù ,"depot, storehouse, warehouse",,,,zhèxiē xiāngzi bèi duīfàng zài yī gè cāngkù lǐ,这些箱子被堆放在一个仓库里。,The boxes are stacked in a warehouse.,
6,21,1,12,,,储备,chǔbèi ,"reserves, to store up",,,,wǒmen yīngdāng chǔbèi qián liú zhe jíyòng,我们应当储备钱留着急用。,We must reserve money for emergencies.,
6,21,1,13,,,结算,jiésuàn ,"to settle a bill, to close an account",,,,yú kuǎn jiésuàn,余款结算,Settlement of Balance,
6,21,1,14,,,模式,móshì ,"mode, method, pattern",,,,dàguīmó dìngzhì shì dāngqián zuì xiānjìn de shēngchǎn móshì,大规模定制是当前最先进的生产模式。,Mass Customization is the most advanced production mode.,
6,21,1,15,,,把手,bǎshǒu ,"handle, grip, knob",,,,tā pǎo xiàng mén wúlì dì yáodòng mén bǎshǒu,他跑向门，无力地摇动门把手。,She ran to the door and shook the handle impotently.,
6,21,1,16,,,装卸,zhuāngxiè ,"to load or unload, to transfer, to assemble and disassemble",,,,gǎngkǒu zhuāngxiè jīxiè,港口装卸机械,port cargo handling machinery,
6,21,1,17,,,屏幕,píngmù ,"screen (TV, computer or movie)",,,,xiǎnshì píngmù jìshù,显示屏幕技术,display screen technology,
6,21,1,18,,,相应,xiāngyìng ,"to correspond, answering (one another), to agree (among the part)",,,,bǎ shùzì shū rén xiāngyìng de kònggé jiù zhème jiǎndān,把数字输人相应的空格。就这么简单！,Enter the numbers into the appropriate blanks．It's as simple as that!,
6,21,1,19,,,仪器,yíqì ,"instrument, apparatus",,,,shǐyòng zhīqián yíqì bìxū shēngwēn,使用之前仪器必须升温。,The instrument must be warmed up before it is put into practice.,
6,21,1,20,,,以免,yǐmiǎn ,"in order to avoid, so as not to",,,,nǐ bìxū liúyì yǐmiǎn chūcuò,你必须留意以免出错。,You must guard against errors.,
6,21,1,21,,,嫌,xián ,"to dislike, suspicion, resentment, enmity",,,,dàjiā dōu xián tā píqi tài jí,大家都嫌他脾气太急。,Everybody disliked him because of his hot temper.,
6,21,1,22,,,腥,xīng ,fishy (smell),,,,yǒuxiērén xǐhuan kàn xuèxīng de yǐngpiàn,有些人喜欢看血腥的影片。,Some people like to watch the bloody films.,
6,21,1,23,,,清理,qīnglǐ ,"to clear up, to tidy up, to dispose of",,,,tā fēnfù yōngrén qīnglǐ kètīng,他吩咐佣人清理客厅。,He bade the servant clean the living room.,
6,21,1,24,,,等候,děnghòu ,"to wait, to wait for",,,,hěn duō rén páiduì děnghòu qìchē,很多人排队等候汽车。,Many people were queuing up for the bus.,
6,21,1,25,,,性能,xìngnéng ,"function, performance",,,,zēngqiáng sùliào jùyǒu duōzhǒng xìngnéng,增强塑料具有多种性能。,Reinforced plastics possess many diverse properties.,
6,21,1,26,,,便利,biànlì ,"convenient, easy, to facilitate",,,,zěnme biànlì jiù zěnmebàn,怎么便利就怎么办。,Do whatever is expedient.,
6,21,1,27,,,把关,bǎguān ,"to guard a pass, to check on sth",,,,tā bèi zhǐ pàiduì zhìliàng wèntí bǎguān,他被指派对质量问题把关。,He was assigned to guarantee the quality of products.,
6,21,1,28,,,人工,réngōng ,"artificial, manpower, manual work",,,,réngōnghūxī,人工呼吸,artificial respiration,
6,21,1,29,,,秤,chèng ,"steelyard, Roman balance",,,,tánhuángchèng,弹簧秤,spring scale,
6,21,1,30,,,运算,yùnsuàn ,(mathematical) operation,,,,jiā、 jiǎn、 chéng、 chú dōu shì èryuán yùnsuàn,加、减、乘、除都是二元运算。,"Addition, subtraction, multiplication, and division are binary operations.",
6,21,1,31,,,总和,zǒnghé ,sum,,,,zhèxiē shùzì de zǒnghé shì duōshao,这些数字的总和是多少？,How much do all these figures stack up to?,
6,21,1,32,,,着重,zhuózhòng ,"to put emphasis on, to stress",,,,zhuózhòng kǒutóu liànxí,着重口头练习。,give emphasis to oral practice,
6,21,1,33,,,虚拟,xūnǐ ,"fictitious, theoretical, hypothetical, (computing) virtual",,,,zài zhège jùzi lǐ dòngcí yòng de shì xūnǐ yǔqì,在这个句子里，动词用的是虚拟语气。,In this sentence the verb is in the subjunctive mood.,
6,21,1,34,,,投票,tóupiào ,"to vote, vote",,,,wǒ qìquán bù tóupiào,我弃权不投票。,I abstained from voting.,
6,21,1,35,,,保管,bǎoguǎn ,"to assure, to guarantee, to take care of, to safeguard, certainly",,,,wénjiàn yóu wǒ de lǜshī bǎoguǎn zhe,文件由我的律师保管着。,The documents are in the custody of my solicitor.,
6,21,1,36,,,新颖,xīnyǐng ,"lit. new bud, fig. new and original",,,,gòusī xīnyǐng,构思新颖,original concept,
6,21,1,37,,,羽绒服,yǔróngfú ,down-filled garment,,,,lóngzhòng tuīchū jīnnián liúxíng de gè shì yǔróngfú,隆重推出今年流行的各式羽绒服,Grandly come out with this year's fashionaBle eiderdown outwear of various kinds.,
6,21,1,38,,,旗袍,qípáo ,"Chinese-style dress, cheongsam",,,,chuántǒng qípáo,传统旗袍,Chinese-style frock,
6,21,1,39,,Outside HSK,中意,zhòngyì ,to be one’s liking,,,,,,,
6,21,1,40,,,音响,yīnxiǎng ,"sound, acoustics, audio, hi-fi system, stereo sound system",,,,yǐ lìtǐ yīnxiǎng lù yīnyuè,以立体音响录音乐,record music in stereo,
6,21,1,41,,,收音机,shōuyīnjī ,radio,,,,qǐngdiào yīxià nàge shōuyīnjī de yīnliàng,请调一下那个收音机的音量。,Please regulate the sound on that radio.,
6,21,1,42,,,水龙头,shuǐlóngtóu ,"faucet, tap",,,,suíshǒu guānjǐn shuǐlóngtóu,随手关紧水龙头。,Don't leave the tap running after use.,
6,21,1,43,,,枚,méi ,measure word for disk-like things,,,,zhè méi yìngbì shì jiǎde,这枚硬币是假的。,This coin is a counterfeit.,
6,21,1,44,,,纽扣儿,niǔkòu ,button,,,,tā jiěkāi le chènyī niǔkòu,他解开了衬衣纽扣。,He unfastened the buttons of his shirt.,
6,21,1,45,,,插座,chāzuò ,"socket, outlet",,,,diàndēngpào chāzuò,电灯泡插座。,a socket for an electric light bulb,
6,21,1,46,,,勘探,kāntàn ,exploration,,,,dìqiúwùlǐ kāntàn de yīzhǒng fāngfǎ jiùshì dìzhèn fǎ,地球物理勘探的一种方法就是地震法。,One method used in a geophysical exploration is called seismic method.,
6,21,1,47,,,矿产,kuàngchǎn ,minerals,,,,kuàng chǎnpǐn jiàgé,矿产品价格,price of mineral products,
6,21,1,48,,,反馈,fǎnkuì ,"to send back information, feedback",,,,zhēngqiú xuésheng duì xīn kèchéng shèzhì de fǎnkuì,征求学生对新课程设置的反馈。,ask the students for feedback on the new curriculum,
6,21,1,49,,,款式,kuǎnshì ,"pattern, style, design",,,,wǒ bù xǐhuan zhè shàngzhuāng de kuǎnshì,我不喜欢这上装的款式。,I don' t like the set of this coat.,
6,21,1,50,,,关怀,guānhuái ,"care, solicitude, to show care for, concerned about, attentive to",,,,tā xiàng cí fù bān guānhuái nǐ,他像慈父般关怀你。,"He has a paternal concern for your welfare, ie like that of a father for his child.",
6,21,1,51,,,无微不至,wúwēibùzhì ,in every possible way (idiom); meticulous,,,,wúwēibùzhì de guānxīn,无微不至的关心,painstaking care,
6,21,1,52,,,需求,xūqiú ,"requirement, (economics) demand",,,,mǎnzú xiāofèizhě de xūqiú,满足消费者的需求,meeting consumer demand,
6,21,1,53,,,主导,zhǔdǎo ,"leading, dominant, prevailing, to lead, to direct, to dominate",,,,tā zài jùlèbù lǐ qǐ zhǔdǎo zuòyòng,他在俱乐部里起主导作用。,He takes a leading part in the club.,
6,21,1,54,,,兴隆,xīnglóng ,to prosper,,,,tā de shēngyì kànqǐlái xīnglóng fādá,他的生意看起来兴隆发达。,His business seems to be flourishing.,
6,21,扩展,,,,商标,shāngbiāo ,"trademark, logo",,,,shāngbiāo shǐyòng xǔkě hétong yīngdāng bào shāngbiāo jú bèi'àn,商标使用许可合同应当报商标局备案。,The trademark license contract shall be submitted to the Trademark Office for record.,
6,21,扩展,,,,城堡,chéngbǎo ,"castle, rook (chess piece)",,,,cǐ chéngbǎo jiàn yú gǔ Luómǎ shídài,此城堡建于古罗马时代。,The castle dates back to the ancient Rome days.,
6,21,扩展,,,,棍棒,gùnbàng ,"club, staff, stick",,,,yòng biānzi huò gùnbàng měngliè dì dǎ,用鞭子或棍棒猛烈地打。,beat severely with a whip or rod.,
6,21,扩展,,,,炉灶,lúzào ,stove,,,,lúzào yīn rè ér fāhóng guāng,炉灶因热而发红光。,The oven glows with heat.,
6,21,扩展,,,,喇叭,lǎba ,"horn (automobile etc), loudspeaker",,,,lǎba fāchū dū dū shēng,喇叭发出嘟嘟声。,The trumpet blared (forth).,
6,21,扩展,,,,堤坝,dībà ,dam,,,,héshuǐ chōng duàn le dībà,河水冲断了堤坝。,The river broke its banks.,
6,21,扩展,,,,园林,yuánlín ,"gardens, park, landscape garden",,,,Sūzhōu yuánlín,苏州园林,Suzhou traditional garden,
6,21,扩展,,,,涮,shuàn ,"to rinse, to instant-boil (as in hotpot)",,,,shuàn niúròu,涮牛肉,scoured beef | instant beef boiled | instant boiled mutton,
6,22,1,1,,,堵塞,dǔsè ,"to block, to stop, blockage",,,,guǎndào dǔsè le,管道堵塞了。,There's a blockage in the pipe.,
6,22,1,2,,,滞留,zhìliú ,"to detain, retention",,,,tā xiànzài zhèng zhìliú Niǔyuē,他现在正滞留纽约。,He is visiting in New York.,
6,22,1,3,,,折磨,zhémó ,"to persecute, to torment",,,,tā wéi èmèng suǒ zhémó,他为噩梦所折磨。,He is troubled with nightmare.,
6,22,1,4,,,翼,yì ,wing,,,,nà zhǐ niǎo gǔ yì xiàng hé de shàngyóu fēi qù,那只鸟鼓翼向河的上游飞去。,The bird flapped (its way) up the stream.,
6,22,1,5,,,担保,dānbǎo ,"to guarantee, to vouch for",,,,wǒ kěyǐ dānbǎo nàshi quèshí de,我可以担保那是确实的。,I'll go bail for that.,
6,22,1,6,,,大体,dàtǐ ,"in general, more or less, in rough terms, basically, on the whole",,,,zhèzhǒng shuōfa zhǐshì dàtǐshàng zhèngquè,这种说法只是大体上正确。,This statement is true only on the average.,
6,22,1,7,,Outside HSK,勾画,gōuhuà ,"to sketch out, to delineate",,,,,,,
6,22,1,8,,,轮廓,lúnkuò ,"an outline, silhouette",,,,tiānkōng chèntuō chū mótiāndàlóu de lúnkuò,天空衬托出摩天大楼的轮廓。,Sky scrapers were outlined against the sky.,
6,22,1,9,,,指责,zhǐzé ,"to criticize, to find fault with, to denounce",,,,tā zhǐzé lǎobǎn bù shǒuxìn,他指责老板不守信。,He accused his boss of having broken his word.,
6,22,1,10,,,融化,rónghuà ,"to melt, to thaw, to dissolve, to blend into, to combine, to fuse",,,,rè kě shǐ bīng rónghuà,热可使冰融化。,Heat can dissolve ice.,
6,22,1,11,,,石油,shíyóu ,"oil, petroleum",,,,huà jiāyòng shíyóu róngjì xīshì yóuliào,画家用石油溶剂稀释油料。,The painter thinned the paint down with white spirit.,
6,22,1,12,,,事故,shìgù ,accident,,,,yīcì bùkěbìmiǎn de shìgù,一次不可避免的事故,an unavoidable accident,
6,22,1,13,,,割,gē ,"to cut, to cut apart",,,,gāi shì gē dàozi de shíhou le,该是割稻子的时候了。,It is time to cut the rice.,
6,22,1,14,,,优胜劣汰,yōushèng lüè tài ,"winning, superiorplan, strategy, outline, summary, slightly, rather",,,,yōushèngliètài jīzhì,优胜劣汰机制,Mechanism for selecting the superior and eliminating,
6,22,1,15,,,皆,jiē ,"all, each and every, in all cases",,,,rén jiē yǒu guò,人皆有过。,Every man hath [has] his faults.,
6,22,1,16,,,明智,míngzhì ,"sensible, wise, judicious, sagacious",,,,fàn hòu lìkè xǐzǎo shì bùmíng zhì de,饭后立刻洗澡是不明智的。,It is unwise to bathe immediately after a meal.,
6,22,1,17,,,出路,chūlù ,a way out (of a difficulty etc),,,,chūlù shì yīdìng nénggòu zhǎodào de,出路是一定能够找到的。,A way out is sure to be found.,
6,22,1,18,,,规范,guīfàn ,"norm, standard, specification, regulation, rule, within the rules",,,,xíngwéi de guīfàn,行为的规范,regulation of conduct,
6,22,1,19,,,谋求,móuqiú ,"to seek, to strive for",,,,bìxū móuqiú hélǐ de pínghéng,必须谋求合理的平衡。,A reasonable balance must be found.,
6,22,1,20,,,干预,gānyù ,"to meddle, to intervene, intervention",,,,tā bùxiǎng gānyù rènhé rén de shì,他不想干预任何人的事。,He didn't want to barge into any one's business.,
6,22,1,21,,,平坦,píngtǎn ,"level, even, smooth, flat",,,,guò le shùlín dìmiàn jiù píngtǎn qilai le,过了树林，地面就平坦起来了。,The ground levels off beyond the woods.,
6,22,1,22,,,奔驰,bēnchí ,"to speed, to gallop",,,,huǒchē zài liǎng tiáo gāngguǐ shàng bēnchí,火车在两条钢轨上奔驰。,Trains run on two rails.,
6,22,1,23,,,试图,shìtú ,"to attempt, to try",,,,tā bìng méiyǒu shìtú lánzǔ tā,他并没有试图拦阻她。,He did not try to hinder her.,
6,22,1,24,,,引导,yǐndǎo ,"to guide, to lead (around), to conduct, to boot, introduction, primer",,,,tā shì wǒmen de xiàngdǎo yīlù yǐndǎo dehěn hǎo,他是我们的向导，一路引导得很好。,He was our guide and directed well all the way.,
6,22,1,25,,,串,chuàn ,"to string together, a string",,,,zhèxiē nǚhái zhèngzài chuàn zhēnzhū,这些女孩正在串珍珠。,These girls are stringing pearls.,
6,22,1,26,,,珍珠,zhēnzhū ,pearl,,,,yù xún zhēnzhū jiùyào qián dào shuǐdǐ,欲寻珍珠就要潜到水底。,He who would search for pearls must dive below.,
6,22,1,27,,,效益,xiàoyì ,"benefit, effectiveness, efficiency",,,,chéngběn xiàoyì fēnxī,成本效益分析,cost - efficiency analysis,
6,22,1,28,,,抵达,dǐdá ,"to arrive, to reach (a destination)",,,,wǒ gūjì zhèngwǔ dǐdá Délǐ,我估计正午抵达德里。,I reckon to arrive in Delhi at noon.,
6,22,1,29,,,终点,zhōngdiǎn ,"the end, end point, finishing line (in a race), destination, terminus",,,,Guǎngzhōu zài tiělù de zhōngdiǎn,广州在铁路的终点。,Guangzhou is at the end of the railway line.,
6,22,1,30,,,配备,pèibèi ,"to allocate, to provide, to outfit with",,,,qiángdào yǒu bùqiāng pèibèi,强盗有步枪配备。,The robber was armed with a rifle.,
6,22,1,31,,,停泊,tíngbó ,"to anchor, anchorage, mooring (of a ship)",,,,guā dàfēng shí chuánzhī tíngbó zài gǎng nèi,刮大风时船只停泊在港内。,During the gale the ships stayed in the harbor.,
6,22,1,32,,,力求,lìqiú ,"to make every effort to, striving to do one's best",,,,lìqiú dēngshàng shāndǐng,力求登上山顶。,make a strenuous attempt to reach the top of the mountain,
6,22,1,33,,,丙,bǐng ,third of the ten Heavenly Stems,,,,bǐng： duōxiè,丙：多谢。,C: Thank you very much.,
6,22,1,34,,Outside HSK,融合,rónghé ,"a mixture, an amalgam, fusion, welding together",,,,,,,
