5,4,1,40,,,食物,shíwù,food,,,,shíwù zài xiàtiān róngyì biànzhì,食物在夏天容易变质。,Food is apt to deteriorate in summer.,
5,5,1,1,,,悠久,yōujiǔ ,"long-standing, ageold",,,,Zhōngguó jùyǒu wǔ qiānnián yōujiǔ lìshǐ,中国具有五千年悠久历史。,"China has a long history of 5,000 years.",
5,5,1,2,,,文字,wénzì ,written language,,,,wǒ wéi bàozhǐ gōngzuò shí shǐyòng wénzì chǔlǐ ruǎnjiàn,我为报纸工作时使用文字处理软件。,I've used word-processing programs for my work on the newspaper.,
5,5,1,3,,HSK 6,记载,jìzǎi ,"to record, to put down in writing",,,,,,,
5,5,1,4,,,形状,xíngzhuàng ,shape,,,,rì ěr yǐ gèzhǒng xíngzhuàng chūxiàn,日珥以各种形状出现。,Prominences occur in a variety of forms.,
5,5,扩展,4,,,神话,shénhuà ,mythology; fairytail,,,,Xīlàshénhuà,希腊神话,Greek mythology,
5,5,1,5,,,描写,miáoxiě ,"to describe, to depict",,,,tā shànyú miáoxiě,他善于描写。,He is good at describing.,
5,5,1,6,,,赞美,zànměi ,"to praise, to extol",,,,tā zànměi zhè fú huà,他赞美这幅画。,He admired the picture.,
5,5,扩展,6,,,风格,fēnggé ,"style, manner",,,,wǒ xǐhuan de shì tā de fēnggé,我喜欢的是她的风格。,What I like is her style.,
5,5,1,7,,,诗,shī ,poem,,,,nǐ néng bèisòng zhè shǒu shī ma,你能背诵这首诗吗？,Can you recite the poem?,
5,5,1,8,,,老百姓,lǎobǎixìng ,"ordinary people, civilians",,,,pǔtōnglǎobǎixìng cái shì yī gè guójiā de línghún,普通老百姓才是一个国家的灵魂。,It is the ordinary people who are the soul of a country.,
5,5,1,9,,,充满,chōngmǎn ,to be full of,,,,Měiguó de xiǎoshuō chōngmǎn xiànshí de qìxī,美国的小说充满现时的气息。,American fiction is alive with the sense of the present moment.,
5,5,扩展,9,,,生动,shēngdòng ,"lively, vivid",,,,tā de wénbǐ shēngdòng bīzhēn,他的文笔生动逼真。,His style is vivid and realistic.,Yes
5,5,1,10,,,感激,gǎnjī ,to feel grateful,,,,wǒ zhēn de hěn gǎnjī nà wèi nǚshì,我真的很感激那位女士。,I feel so grateful to the young lady.,
5,5,1,11,,,从而,cóng'ér ,"thus, consequently",,,,chuán jíshí zhuǎnxiàng shàngfēng cóng'ér bìmiǎn le wēixiǎn,船及时转向上风，从而避免了危险。,The boat clawed off in time and thus avoided danger.,
5,5,1,12,,,产生,chǎnshēng ,to emerge,,,,guǎnlǐ bùmén de biàndòng huì chǎnshēng yīliánchuàn de wèntí,管理部门的变动会产生一连串的问题。,A change of management would produce a crop of problems.,
5,5,1,13,,,传说,chuánshuō ,legend,,,,mínjiānchuánshuō,民间传说,popular legend,
5,5,1,14,,,善良,shànliáng ,kind-hearted,,,,tā shì wǒ kàn dào de gūniang zhōng zuì shànliáng de yī gè,她是我看到的姑娘中最善良的一个,She is one of the most kind-hearted girls that I saw.,
5,5,1,15,,,救,jiù ,"to save, to rescue",,,,tā màozheshēngmìngwēixiǎn qù jiù háizi,他冒着生命危险去救孩子。,He risked his life to save the child.,
5,5,1,16,,,晕,yūn ,"to faint, to pass out",,,,wǒmen è dé kuàiyào yūn guòqu le,我们饿得快要晕过去了。,We felt faint for lack of food.,
5,5,1,17,,,龙,lóng ,dragon,,,,lóng de zuǐlǐ shèchū yānhuā huǒyàn lái,龙的嘴里射出烟花火焰来。,The dragon shot fumes and flames out of its mouth.,
5,5,1,18,,,治疗,zhìliáo ,"to treat, to cure",,,,tā shēngbìng de fùqīn zhèngzài zhùyuànzhìliáo,他生病的父亲正在住院治疗。,His sick father is in the hospital.,
5,5,1,19,,HSK 6,玉,yù ,jade,,,,,,,
5,5,1,20,,,壶,hú ,"pot, kettle",,,,qǐng gěi wǒ yī bǎ hú,请给我一把壶。,"Give me a pot, please.",Yes
5,5,1,21,,,抢,qiǎng ,"to rob, to snatch",,,,tā qīzi suō shǐ tā qù qiǎng yínháng,他妻子唆使他去抢银行。,His wife drove him on to rob the bank,
5,5,1,22,,HSK 6,埋,mái ,to bury,,,,,,,
5,5,1,23,,,躲藏,duǒ cáng ,to hide,,,,xiè duǒcáng zài dòng lǐ,蟹躲藏在洞里。,Crabs harbor in holes.,
5,5,1,24,,,如今,rújīn ,"nowadays, present",,,,rújīn zài tí nàxiē yě méishénme yòng le,如今再提那些也没什么用了。,It's no use mentioning that now.,Yes
5,5,1,25,,,分布,fēnbù ,"to be distributed (over an area), to be scattered",,,,zhèzhǒng húdié zài wǒguó fēnbù hěn guǎng,这种蝴蝶在我国分布很广,This species of butterfly be widely distribute over our country,
5,5,1,26,,Outside HSK,天然,tiānrán ,natural,,,,,,,
5,5,1,27,,,优美,yōuměi ,"graceful, beautiful",,,,qūxiàn yōuměi,曲线优美,Have a graceful figure; get a shape; be shapely,
5,5,1,28,,,独特,dútè ,"unique, distinctive ",,,,zhèxiē xīn lǐlùn yǒu dútè zhī chǔ,这些新理论有独特之处。,There was something unique about the new theories.,
5,5,1,29,,,反映,fǎnyìng ,"to reflect, to mirror",,,,tā de xíngwéi fǎnyìng tā de sīxiǎng,她的行为反映她的思想。,Her actions reflect her thought.,
5,5,1,30,,HSK 6,珍珠,zhēnzhū ,pearl,,,,,,,
5,5,1,31,,,形成,xíngchéng ,"to form, to take shape",,,,shuǐ shèntòu shíhuīshí zé xíngchéng dòngxué,水渗透石灰石则形成洞穴。,Caves form when water infiltrates limestone.,
5,5,1,32,,,于,yú ,"from, out of",,,,rénzàonǎiyóu láiyuányú zhíwùyóu,人造奶油来源于植物油。,Margarine is derived from vegetable oil.,
5,5,1,33,,,广大,guǎngdà ,"vast, extensive",,,,zhè shìzhèn shì gè guǎngdà de pínmínqū,这市镇是个广大的贫民区。,The town is one vast slum land.,
5,5,1,34,,HSK 6,岩石,yánshí ,rock,,,,,,,
5,5,1,35,,,亿,yì ,hundred million,,,,tā tǒngzhì zhe3 yì rén,他统治着3 亿人。,He reigned over 300 millions of men.,
5,5,1,36,,Outside HSK,石灰岩,shíhuīyán ,limestone,,,,,,,
5,5,1,37,,,地区,dìqū ,"area, region ",,,,jǐ zhǒng gōngyè zhèngzài zhège dìqū fāzhǎn,几种工业正在这个地区发展。,Several industries are developing in this area.,
5,5,1,38,,,表面,biǎomiàn ,surface,,,,huǒxīng de biǎomiàn cēncībùqí,火星的表面参差不齐。,The surface of Mars is remarkably diverse.,
5,5,1,39,,,角度,jiǎodù ,"angle, degree of angle",,,,jiǎodù tài dà,角度太大。,The angle is too great.,
5,5,1,40,,,斜,xié ,"oblique, slanting",,,,yǒumíng de bǐsà tǎ shì xié de,有名的比萨塔是斜的。,The famous tower of Pisa leans at an angle.,
5,5,1,41,,,为,wéi ,to become,,,,xiǎoqǐyè kě zhuǎnbiàn wéi gǔfèn hézuò zhì,小企业可转变为股份合作制。,Smaller enterprises can become shareholding co-operatives,
5,5,1,42,,Outside HSK,火成岩,huǒchéngyán ,igneous rock,,,,,,,
5,5,1,43,,,碰,pèng ,"to meet, to come across",,,,zài zhèr pèngdào nǐ zhēnshi xìngyùn,在这儿碰到你真是幸运!,What a stroke of luck to meet you here!,
5,5,1,44,,,挡,dǎng ,"to block, to get in the way of",,,,duìbuqǐ dǎng zhe nǐ de lù le,对不起，挡着你的路了。,I beg your pardon for being in your way.,
5,5,1,45,,HSK 6,地势,dìshì ,"terrain, topography",,,,,,,
5,5,1,46,,,冲,chōng ,"to rush, to dash",,,,tā xiàng duìshǒu chōng qù,他向对手冲去。,He rushed at his opponent.,Yes
5,6,1,1,,,除夕,Chúxī ,eve of the Lunar New Year/Spring Festival,,,,nǐmen rúhé dùguò Chúxī zhī yè,你们如何度过除夕之夜？,How do you spend your New Year's Eve?,
5,6,扩展,1,,,名胜古迹,míngshènggǔjì ,places of historic interests and scenic beauty.,,,,Xī'ān yǒu hěn duō míngshènggǔjì,西安有很多名胜古迹。,It has many places of interest.,
5,6,1,2,,Outside HSK,由来,yóulái ,"origin, source",,,,,,,
5,6,1,3,,HSK 6,农历,nónglì ,lunar calendar,,,,,,,
5,6,扩展,3,,,展览,zhǎnlǎn ,"put on display, exhibit ",,,,màoyì zhǎnlǎn,贸易展览,Trade show,
5,6,1,4,,,守岁,shǒusuì ,to stay up late or all night on New Year’s Eve,,,,Chúxī shǒusuì,除夕守岁,To observe the year out on new-year's eve,
5,6,扩展,4,,,合影,héyǐng ,group photo,,,,zhèr yǒu yī zhāng hé ZhōuĒnlái zǒnglǐ de héyǐng zhàopiàn,这儿有一张和周恩来总理的合影照片。,and here's a picture of him with Premier Zhou Enlai.,
5,6,1,5,,Outside HSK,怪物,guàiwu ,monster,,,,,,,
5,6,扩展,5,,,预订,yùdìng ,"to book, to predetermine",,,,wǒ zài Táiběi yǐ yùdìng fángjiān,我在台北已预订房间。,I made a reservation in Taipei.,
5,6,1,6,,,伤害,shānghài ,"to hurt, to harm",,,,bùyào shānghài rènhé rén,不要伤害任何人。,Don't inflict damage on any person.,
5,6,扩展,6,,,结账,jiézhàng ,"settle accounts, to pay the bills",,,,qǐng jiézhàng,请结账。,I'd like to pay the bill.,
5,6,1,7,,,恨,hèn ,to hate,,,,wǒ hèn nǐ,我恨你!,I hate you!,
5,6,扩展,7,,,团,tuán ,"group, society, organization",,,,zhège lǚyóutuán shòudào shìzhǎng de jiējiàn,这个旅游团受到市长的接见。,The mayor received the travel group .,
5,6,1,8,,,骨头,gǔtóu ,bone,,,,zhège nánhái shòu dé píbāogǔtóu,这个男孩瘦得皮包骨头。,The boy pined away to skin and bone.,
5,6,扩展,8,,,时差,shíchā ,"time difference, jet lag",,,,Jiùjīnshān gēnshàng hǎi de shíchā shì duōshao,旧金山跟上海的时差是多少?,What is the time difference between San Francisco and Shanghai?,
5,6,1,9,,,无奈,wúnài ,"to have no way out, to be helpless",,,,wǒ yě shì bèi bī wúnài ā,我也是被逼无奈啊!,I had no choice!,
5,6,扩展,9,,,国庆节,Guóqìngjié ,National Day (in China),,,,Guóqìngjié hé Guójì Láodòng Jié zài Zhōngguó shì zhòngdà de jiérì,国庆节和国际劳动节在中国是重大的节日。,The National Day and the International Labour Day are great events in China.,
5,6,1,10,,,英雄,yīngxióng ,hero,,,,nà wèi yīngxióng shòudào rénqún de rèliè huānyíng,那位英雄受到人群的热烈欢迎。,The hero received a great ovation from the crowd.,
5,6,1,11,,,英俊,yīngjùn ,handsome,,,,tā kànshangqu yīngjùn ér jiànkāng,他看上去英俊而健康。,He looked handsome and healthy.,
5,6,1,12,,,咬,yǎo ,to bite,,,,nǐ de gǒu yǎo rén ma,你的狗咬人吗?,Does your dog bite? ie Is it in the habit of biting people?,
5,6,1,13,,,外公,wàigōng ,maternal grandfather,,,,tā wàigōng shì gè dà jiǔtú,他外公是个大酒徒。,His grandfather is a three-Bottle man.,
5,6,1,14,,,询问,xúnwèn ,"to ask, to inquire",,,,wǒ qù chēzhàn xúnwèn yǒuguān huǒchē de qíngkuàng,我去车站询问有关火车的情况。,I went to the station to ask about the train.,
5,6,1,15,,,天真,tiānzhēn ,"naive, innocent",,,,tiānzhēn de nǚhái,天真的女孩,a naive girl,
5,6,1,16,,,杀,shā ,to kill,,,,shì kě shā bùkě rǔ,士可杀，不可辱。,A scholar prefers death to humiliation.,
5,6,1,17,,,代替,dài tì ,"for, on behalf of",,,,gǎnqíng bùnéng dàitì zhèngcè,感情不能代替政策。,Emotion should never be a substitute for sound policy.,
5,6,1,18,,HSK 6,除,chú ,"to get rid of, to remove",,,,,,,
5,6,1,19,,,制造,zhìzào ,"to make, to produce",,,,tāmen zhèngzài yòng yīzhǒng xīn fāngfǎ zhìzào bōli,他们正在用一种新方法制造玻璃。,They are using a new process to make glass.,
5,6,1,20,,,灾害,zāihài ,"disaster, calamity",,,,jiàngdī zāihài sǔnshī,降低灾害损失,To bring down disaster losses.,
5,6,1,21,,,逃,táo ,to escape,,,,jīngguò qiānxīnwànkǔ wǒ cái táo chūlái le,经过千辛万苦，我才逃出来了。,After much difficulty I contrived to escape.,
5,6,1,22,,,影子,yǐngzi ,shadow,,,,wǒ kànjiàn yī gè nǚrén de yǐngzi,我看见一个女人的影子。,I saw the shadow of a woman.,
5,6,1,23,,,此外,cǐwài ,"in addition, moreover",,,,cǐwài chéngshì yímín hái zēngjiā le láodòng de gōngyìng,此外，城市移民还增加了劳动的供应。,"In addition, urban migrants add to the supply of labor.",
5,6,1,24,,,说不定,shuōbudìng ,"perhaps, possibly, it’s likely that…",,,,shuōbudìng shìqing huì yǒu biànhuà,说不定事情会有变化。,Perhaps things will change.,
5,6,1,25,,,熬夜,áoyè ,to stay up late at night,,,,zuówǎn shìbùshì áoyè le,昨晚是不是熬夜了?,Did you stay up late last night?,
5,6,1,26,,,赶紧,gǎnjǐn ,"immediately, at once, hurry",,,,dōu zhème wǎn le ma wǒmen dé gǎnjǐn zǒu le,都这么晚了吗？我们得赶紧走了。,Is it that late already? We simply must rush off．,
5,6,,27,,,果然,guǒrán,as expected,,,,tā shuō tā huì lái de guǒrán lái le,他说他会来的，果然来了。,"He said he would come, and sure enough he did.",
5,6,1,28,,,姑娘,gūniang ,girl,,,,bìngtòng shǐ nàge niánqīng gūniang qíngxù dīluò,病痛使那个年轻姑娘情绪低落。,The illness depressed the young girl.,Yes
5,6,1,29,,,锅,guō ,"pot, pan",,,,wǒ bǎ tǔdòu fàng dào guō lǐ zhǔ,我把土豆放到锅里煮。,I put the potatoes in a pot and boiled them.,
5,6,1,30,,,盆子,pénzǐ ,"basin, tub",,,,tā bǎ suǒyǒu de yú dōu dǎo jìn pénzi lǐ,他把所有的鱼都倒进盆子里。,He emptied all the fish into the basin.,
5,6,1,31,,,整个,zhěnggè ,"whole, entire",,,,zhěnggè xiàtiān hé qiūtiān wǒ dōu zài zhǎo gōngzuò,整个夏天和秋天我都在找工作。,I spend the summer and fall hunting for a job.,
5,6,1,32,,,吓,xià ,"to frighten, to scare",,,,wǒ zìjǐ dehuà xià le wǒ zìjǐ yī tiào,我自己的话吓了我自己一跳。,My own words startled me.,Yes
5,6,1,33,,,似的,shìde ,"like, as (indicating similarity)",,,,hǎoxiàng yī pén shuǐ pō tā shēnshang shìde,好象一盆水泼他身上似的。,It was as if a basin of water had been emptied over him.,
5,6,1,34,,,追,zhuī ,"to chase, to go after",,,,tā lǎoshi zài zhuī nǚrén,他老是在追女人。,He's always running after women.,
5,6,1,35,,HSK 6,箭,jiàn ,arrow,,,,,,,
5,6,1,36,,,射击,shèjī ,to shoot,,,,shèjī wèi mìngzhòng mùbiāo,射击未命中目标,To shoot short of a target.,
5,6,1,37,,,纷纷,fēnfēn ,"one after another, all at once",,,,wǒmen fēnfēn chāzuǐ tíchūjiànyì,我们纷纷插嘴提出建议。,We all chipped in with our suggestions.,
5,6,1,38,,,表达,biǎodá ,"to express, to voice",,,,wǒ de yōushāng wúfǎ yòng yǔyán biǎodá,我的忧伤无法用语言表达。,No words can express my grief.,
5,6,1,39,,,意义,yìyì ,"meaning, significance",,,,zhèbān húshuō jiūjìng yǒu shénme yìyì ne,这般胡说究竟有什么意义呢?,What earthly meaning can such nonsense have?,
5,6,1,40,,,鞭炮,biānpào ,firecracker,,,,háizimen xǐhuan zài Chūnjié shí fàngbiānpào,孩子们喜欢在春节时放鞭炮。,Children like to shoot off firecrackers in the Spring Festival.,
5,6,1,41,,,风俗,fēngsú,"custom, convention",,,,zhèzhǒng fēngsú qǐyuán yú Míngdài,这种风俗起源于明代。,The custom took its rise from Ming dynasty.,
5,7,1,1,,,成语,chéngyǔ ,"idiom, set phrase",,,,chéngyǔ“ zhǐlùwéimǎ” jiùshì gēnjù zhège gùshi dé lái de,成语“指鹿为马”就是根据这个故事得来的。,"This story gave rise to the idiom"" Calling A Stag A Horse"".",
5,7,1,2,,,则,zé ,piece (used for news or writings),,,,nà zé xīnwén wāiqū le shìshí,那则新闻歪曲了事实。,That piece of news has done violence to the truth .,
5,7,1,3,,Outside HSK,盲人,mángrén ,blind person,,,,,,,
5,7,1,4,,,摸,mō ,"to touch, to feel, to stroke",,,,bùyào mō nà kǒu guō tā hěn tàng,不要摸那口锅，它很烫。,Don't touch that pot. It's very hot.,Yes
5,7,扩展,4,,,字母,zìmǔ ,alphabet,,,,Lādīngzìmǔ,拉丁字母,Latin alphabet; Roman alphabet,
5,7,1,5,,,大象,dà xiàng ,elephant,,,,dàxiàng qūtǐ pángdà,大象躯体庞大。,An elephant has a heavy build.,
5,7,扩展,5,,,声调,shēngdiào ,tone,,,,tā de shēngdiào hěn dànmò,他的声调很淡漠。,His tone was casual.,
5,7,1,6,,,智慧,zhìhuì ,wisdom,,,,tā shì zhìhuì xíng de rénwù,她是智慧型的人物。,She's an intelligent type.,
5,7,扩展,6,,,拼音,pīnyīn ,pinyin,,,,zhèxiē xiǎoxuéshēng men zhèngzài xuéxí pīnyīn cházìfǎ,这些小学生们正在学习拼音查字法。,These primary school students are learning how to look up Chinese characters by pinyin.,
5,7,1,7,,,士兵,shìbīng ,soldier,,,,zhèwèi shìbīng yīn yǒnggǎn ér bèi tíshēng,这位士兵因勇敢而被提升。,The soldier was elevated to a higher rank for bravery.,
5,7,扩展,7,,,语气,yǔqì ,"tone, manner of speaking",,,,xūnǐ yǔqì,虚拟语气,the subjunctive mood,Yes
5,7,1,8,,,瞎,xiā ,"to be blind, blindly, foolishly",,,,tā shì yī gè yòu lóng yòu xiā de rén,他是一个又聋又瞎的人。,He is a deaf blind creature.,
5,7,1,9,,,分别,fēnbié ,"respectively, separately",,,,tā jiàchē bǎ tāmen fēnbié sòng dàojiā lǐ,他驾车把他们分别送到家里。,He drove them both to their respective homes.,
5,7,扩展,9,,,否定,fǒudìng ,"negate, deny",,,,zhèxiē shìshí fǒudìng le nǐ de lǐlùn,这些事实否定了你的理论。,These facts negate your theory.,
5,7,1,10,,,寻找,xúnzhǎo ,"to look for, to seek",,,,xúnzhǎo bìnànsuǒ,寻找避难所,To seek refuge.,
5,7,扩展,10,,,省略,shěnglüè ,"leave out, omit",,,,zhège jùzi de zhǔyǔ bèi shěnglüè diào le,这个句子的主语被省略掉了。,The subject of this sentence has been omitted.,Yes
5,7,1,11,,,牙齿,yáchǐ ,tooth,,,,wǒ de yáchǐ zhù le liǎng gè dòng,我的牙齿蛀了两个洞。,My tooth has bored through two caves.,
5,7,1,12,,,胡说,húshuō ,to talk nonsense,,,,tā shuō wǒ yào cízhí zhè wánquán shì húshuō,她说我要辞职，这完全是胡说。,She was talking through the back of her neck when she said I was going to resign from my job.,
5,7,1,13,,,尾巴,wěiba ,tail,,,,gǒu jiā zhe wěiba táozǒu le,狗夹着尾巴逃走了。,The dog slunk away with its tail between its legs.,
5,7,1,14,,,绳子,shéngzi ,rope,,,,shéngzi yào sōng xiē,绳子要松些。,We need more play on the rope.,
5,7,1,15,,,平,píng ,"flat, level",,,,jǐnliàng bǎ miàntuán gǎn píng,尽量把面团擀平。,Roll the pastry as flat as you can.,
5,7,1,16,,,墙,qiáng ,wall,,,,tā yòng shuāzi tú qiáng,他用刷子涂墙。,He painted the wall with a brush.,
5,7,1,17,,,扇子,shànzi ,fan,,,,biàn bǎ shànzi shōu qilai,便把扇子收起来。,With that she took the fan from him.,
5,7,1,18,,,片面,piànmiàn ,one-sided,,,,piànmiàn de lùndiǎn,片面的论点,a one-sided argument,
5,7,1,19,,,结论,jiélùn ,conclusion,,,,tāmen fēnbié déchū le tóngyī jiélùn,他们分别得出了同一结论。,They had all severally reached the same conclusion.,
5,7,1,20,,Outside HSK,精诚所至，金石为开,jīngchéngsuǒzhì， jīnshí wéi kāi ,lit. absolute sincerity can affect even metal and stone; fig. no difficulty is insurmountable if one sets his/her mind on it,,,,,,,
5,7,1,21,,HSK 6,将军,jiāngjūn ,general,,,,,,,
5,7,1,22,,,善于,shànyú ,to be good at,,,,tā shànyú tǎojiàhuánjià,他善于讨价还价。,He's good at bargaining.,
5,7,1,23,,,称,chēng ,"to call, to give somebody a particular name",,,,wǒmen xiànzài chēng tā wéi gùgōng,我们现在称它为故宫,We call it the Former Imperial Palace now.,
5,7,1,24,,HSK 6,打猎,dǎliè ,to go hunting,,,,,,,
5,7,1,25,,,忽然,hūrán ,suddenly,,,,hūrán xià qǐ le pāngtuódàyǔ,忽然下起了滂沱大雨。,when it suddenly began to rain very hard.,
5,7,1,26,,,蹲,dūn ,"to squat, to crouch",,,,tā dūn le xiàlai,他蹲了下来。,He squatted himself down.,
5,7,1,27,,,摇,yáo ,"to wave, to shake",,,,wǒ bǎ chēchuāng yáo shàngqù nǐ jièyì ma,我把车窗摇上去，你介意吗?,Do you mind if I wind up the window?,
5,7,1,28,,,不要紧,bùyàojǐn ,it doesn’t matter,,,,bùyàojǐn bùyàojǐn,不要紧，不要紧！,It really doesn't matter.,
5,7,1,29,,,支,zhī ,"measure word used for long, thin, inflexible objects",,,,tā yǎnchàng de jǐ zhī gēqǔ hěn shòuhuānyíng,她演唱的几支歌曲很受欢迎。,Her numbers were well received.,
5,7,1,30,,,摆,bǎi ,"to put, to place, to set in order",,,,líkāi qián qǐng bǎ dōngxi bǎi zhěngqí,离开前请把东西摆整齐。,Please put everything in apple-pie order before you leave.,
5,7,1,31,,,姿势,zīshì ,"pose, posture",,,,wǒmen lái bǎi hǎo zīshì héyǐng yī zhāng,我们来摆好姿势合影一张。,Let 's pose for a group photo .,
5,7,1,32,,Outside HSK,全神贯注,quánshénguànzhù ,"to concentrate on, to be absorbed in",,,,,,,
5,7,1,33,,,尽力,jìnlì ,to try one’s best,,,,jìnlì bìmiǎn wēixiǎn,尽力避免危险。,Try to avoid danger.,
5,7,1,34,,,反应,fǎnyìng ,to react; response,,,,tā de fǎnyìng shì bèidòng de,他的反应是被动的。,His reaction was passive.,Yes
5,7,1,35,,,确定,quèdìng ,"to confirm, to make sure",,,,nǐ kěyǐ quèdìng wǒ zài Niǔyuē yùdìng de lǚguǎn ma,你可以确定我在纽约预定的旅馆吗?,Can you confirm my hotel reservation in New York?,
5,7,1,36,,,石头,shítou ,"stone, rock",,,,tā jiǎn qǐ yīkuài shítou cháo gǒu dǎ qù,他捡起一块石头朝狗打去。,He picked up a stone and hit the dog.,Yes
5,7,1,37,,,连续,liánxù ,"to be continuous, to be in succession",,,,tā liánxù jǐge yuè dōu zài xiě tā de xiǎoshuō,他连续几个月都在写他的小说。,He worked on his novel for months on end.,
5,7,1,38,,,根 ,gēn ,long thin piece; measure work used for long thin pieces of object,,,,zhè gēn gùnzi bǐ nà gēn cháng yī bèi,这根棍子比那根长一倍。,This rod is as long again as that one.,
5,7,1,39,,,碎,suì ,to break into pieces; broken,,,,bǎ mùtou pī suì,把木头劈碎,chop wood into pieces,
5,7,1,40,,HSK 6,杆,gān ,"pole, shaft",,,,,,,
5,7,1,41,,,唉,āi ,used to express surprise or dissatisfaction,,,,āi zhè yīnchén de rìzi,唉！这阴沉的日子。,Alas! The heavy day!,
5,7,1,42,,,金属,jīnshǔ ,metal,,,,cíqì pánzi bǐ jīnshǔ pánzi bǎowēn shíjiān cháng,瓷器盘子比金属盘子保温时间长。,China dishes retain heat longer than metal pans.,
5,7,1,43,,,硬,yìng ,"hard, tough",,,,zhè chángdèng yòu yìng yòu bùshūfu,这长凳又硬又不舒服。,The bench is hard and uneasy.,
5,7,1,44,,,便,biàn,(sth comes naturally under certain conditions or circumstances),,,,tā cíbié le qīzi biàn qǐchéng le,他辞别了妻子便启程了。,He left his wife and set off.,Yes
5,8,1,1,,Outside HSK,朝三暮四,zhāosānmùsì ,three in the morning and four in the evening (idiom),,,,,,,
5,8,1,2,,,词汇,cíhuì ,vocabulary,,,,tā de cíhuì hěn yǒuxiàn,他的词汇很有限。,His vocabulary is limited.,
5,8,1,3,,,固定,gùdìng ,"fixed, settled; to fix",,,,nǐ yǒuguān xì gùdìng de nánpéngyou ma,你有关系固定的男朋友吗?,Do you have a regular boyfriend?,Yes
5,8,1,4,,,结构,jiégòu ,structure,,,,rúguǒ yào zhǎngwò zhèxiē jiégòu xuésheng jiù bìxū liànxí,如果要掌握这些结构，学生就必须练习。,"If the student is to master these structures, he must practice them.",
5,8,扩展,4,,,豆腐,dòufu ,tofu,,,,dòufu niúròu,豆腐牛肉,beef with tofu;Beef with bean curd,
5,8,1,5,,,整体,zhěngtǐ ,"whole, entirety",,,,zhěngtǐ xíngshì zài rìyì èhuà,整体形势在日益恶化。,The overall situation is deteriorating.,Yes
5,8,扩展,5,,,辣椒,làjiāo ,"chilli, hot petter",,,,làjiāo chǎo jī sī,辣椒炒鸡丝,Stir-fried sliced chicken and green chili,
5,8,1,6,,,综合,zōnghé ,"to summarize; comprehensive, integrated",,,,zhège gōngchǎng shì shìjiè zuì dà de zōnghéxìng huàxué gōngsī zhīyī,这个工厂是世界最大的综合性化学公司之一。,This factory is one of the world's largest diversified chemical companies.,
5,8,扩展,6,,,花生,huāshēng ,peanut,,,,wǒ jīntiān dài le huāshēngjiàng sānmíngzhì,我今天带了花生酱三明治。,I have a peanut butter sandwich today.,
5,8,1,7,,,完整,wánzhěng ,complete,,,,zhè shì fèn wánzhěng de qīngdān ma,这是份完整的清单吗?,Is this a complete list?,
5,8,扩展,7,,,土豆,tǔdòu ,potato,,,,tǔdòuní,土豆泥,Mashed potato; potato mash,
5,8,1,8,,Outside HSK,哲学家,zhéxuéjiā ,philosopher,,,,,,,
5,8,扩展,8,,,玉米,yùmǐ ,corn,,,,tián lǐ bōzhǒng le yùmǐ,田里播种了玉米。,The fields have been seeded with corn.,
5,8,1,9,,HSK 6,寓言,yùyán ,fable,,,,,,,
5,8,1,10,,Outside HSK,喂养,wèiyǎng ,"to feed, to raise",,,,,,,
5,8,1,11,,,群,qún ,"group, herd, flock",,,,tā tóngyī qún nǚháizi yīqǐ lái,她同一群女孩子一起来。,She came in company with a group of girls.,
5,8,扩展,11,,,香肠,xiāngcháng ,sausage,,,,gěi wǒ yī fèn xiāngcháng jiānbǐng háiyǒu èr gè dàn,给我一份香肠煎饼还有二个蛋。,Pancakes with sausage and two eggs.,
5,8,1,12,,,猴子,hóuzi ,monkey,,,,wǒ de hóuzi bù yǎo rén,我的猴子不咬人。,My monkey doesn't bite.,
5,8,1,13,,,宠物,chǒngwù ,pet,,,,nǐ yǒu shénme chǒngwù,你有什么宠物？,What pet do you have?,
5,8,1,14,,,相处,xiāngchǔ ,to get along (with one another),,,,wǒmen xiāngchǔ dé bù róngqià,我们相处得不融洽。,We don't get along well.,Yes
5,8,1,15,,,彼此,bǐcǐ ,each other,,,,dǎcóng chūzhōng kāishǐ tāmen jiù bǐcǐ xiāng'ài,打从初中开始，他们就彼此相爱。,They were stuck on each other ever since junior high school.,
